id,title,score,num_comments,author,created_utc,url,over_18,edited,spoiler,stickied
1kkloil,Barely staying afloat here :'),584,3,plot_twist_incom1ng,2025-05-12 06:25:36,https://i.redd.it/np03np7coa0f1.jpeg,False,False,False,False
1kkip1h,For those who have worked both in data engineering and software engineering....,41,17,thro0away12,2025-05-12 03:20:29,https://www.reddit.com/r/dataengineering/comments/1kkip1h/for_those_who_have_worked_both_in_data/,False,False,False,False
1kkk7vc,Launching a Discord Server for Data Engineering Interviews Prep! (Intern to Senior Level),16,0,NefariousnessSea5101,2025-05-12 04:49:51,https://www.reddit.com/r/dataengineering/comments/1kkk7vc/launching_a_discord_server_for_data_engineering/,False,False,False,False
1kkm5aw,Polars in Rust vs golang custom implementation to replace Pandas real-time feature engineering,13,13,random_lurker01,2025-05-12 06:57:31,https://www.reddit.com/r/dataengineering/comments/1kkm5aw/polars_in_rust_vs_golang_custom_implementation_to/,False,False,False,False
1kkxpw5,PyArrow+Narwhals vs. Polars: Opinions?,8,3,oroberos,2025-05-12 17:00:08,https://www.reddit.com/r/dataengineering/comments/1kkxpw5/pyarrownarwhals_vs_polars_opinions/,False,False,False,False
1kkvpfz,SQL Certification,7,7,t_tamilarasan,2025-05-12 15:41:03,https://www.reddit.com/r/dataengineering/comments/1kkvpfz/sql_certification/,False,False,False,False
1kkvjc8,How can I keep gaining experience through projects?,6,1,daardoo,2025-05-12 15:34:23,https://www.reddit.com/r/dataengineering/comments/1kkvjc8/how_can_i_keep_gaining_experience_through_projects/,False,False,False,False
1kkmyj7,common database for metadata,4,3,Hot_While_6471,2025-05-12 07:55:21,https://www.reddit.com/r/dataengineering/comments/1kkmyj7/common_database_for_metadata/,False,False,False,False
1kkaz9g,Iceberg or delta lake,5,13,Own_Art1586,2025-05-11 20:48:38,https://www.reddit.com/r/dataengineering/comments/1kkaz9g/iceberg_or_delta_lake/,False,False,False,False
1kktodn,What is the name of this profession?,4,29,AmazingBuilding3237,2025-05-12 14:18:48,https://www.reddit.com/r/dataengineering/comments/1kktodn/what_is_the_name_of_this_profession/,False,False,False,False
1kkpf3o,Seeking Advice: Transitioning from Python Scripting to Building Data Pipelines,6,6,JazzlikeFly484,2025-05-12 10:46:36,https://www.reddit.com/r/dataengineering/comments/1kkpf3o/seeking_advice_transitioning_from_python/,False,False,False,False
1kkg2tv,Spark optimization for hadoop writer,3,3,Manyreason,2025-05-12 00:57:18,https://www.reddit.com/r/dataengineering/comments/1kkg2tv/spark_optimization_for_hadoop_writer/,False,False,False,False
1kkvi7j,Replication and/or ETL tools - what's the current pick based on pricing vs features around here?  When to buy vs build?,3,7,reelznfeelz,2025-05-12 15:33:08,https://www.reddit.com/r/dataengineering/comments/1kkvi7j/replication_andor_etl_tools_whats_the_current/,False,False,False,False
1kksxcu,"Maybe I'm the only one who has problems with ""IT Recruiters on Matters Data Engineering"" or something that's already common in Spain?",1,1,moisesllo,2025-05-12 13:46:30,https://www.reddit.com/r/dataengineering/comments/1kksxcu/maybe_im_the_only_one_who_has_problems_with_it/,False,False,False,False
1kk9jxn,Deep research over Google Drive (open source!),3,1,yes-no-maybe_idk,2025-05-11 19:46:41,https://www.reddit.com/r/dataengineering/comments/1kk9jxn/deep_research_over_google_drive_open_source/,False,False,False,False
1kkqev7,How to handle changing data in archived entitys?,2,2,OwlUseful5863,2025-05-12 11:44:24,https://www.reddit.com/r/dataengineering/comments/1kkqev7/how_to_handle_changing_data_in_archived_entitys/,False,False,False,False
1kklrvr,Data Warehousing Dilemma: Base Fact Table + Specific Facts vs. Consolidated Fact - Which is Right?,2,12,Ok-Outlandishness-74,2025-05-12 06:31:33,https://www.reddit.com/r/dataengineering/comments/1kklrvr/data_warehousing_dilemma_base_fact_table_specific/,False,False,False,False
1kkayma,Does anyone have .ova file containing Hadoop and Spark?,2,0,sacred__nelumbo,2025-05-11 20:47:50,https://www.reddit.com/r/dataengineering/comments/1kkayma/does_anyone_have_ova_file_containing_hadoop_and/,False,False,False,False
1kkz2f8,"Feasibility of Big Data Analysis: Tracking Drug-Related Content Trends on Social Media (TikTok, YouTube, Instagram)",1,2,ToeRepresentative391,2025-05-12 17:51:50,https://www.reddit.com/r/dataengineering/comments/1kkz2f8/feasibility_of_big_data_analysis_tracking/,False,False,False,False
1kkyt2t,Participant Invitation – Master's Research Study,1,1,Don-ut,2025-05-12 17:41:56,https://www.reddit.com/r/dataengineering/comments/1kkyt2t/participant_invitation_masters_research_study/,False,False,False,False
1kkylcb,"Snowflake vs Databricks, beyond warehouse/lakehouse capabilities",1,1,Eastern-Sun-3356,2025-05-12 17:33:36,https://www.reddit.com/r/dataengineering/comments/1kkylcb/snowflake_vs_databricks_beyond_warehouselakehouse/,False,False,False,False
1kky5fc,Snowflake to Kafka,1,0,MrGreenPL,2025-05-12 17:16:30,https://www.reddit.com/r/dataengineering/comments/1kky5fc/snowflake_to_kafka/,False,False,False,False
1kkqcic,Dataform,1,1,BusOk1791,2025-05-12 11:40:42,https://www.reddit.com/r/dataengineering/comments/1kkqcic/dataform/,False,False,False,False
1kke6ae,Anyone using MariaDB 11.8’s vector features with local LLMs?,1,1,OttoKekalainen,2025-05-11 23:18:07,https://www.reddit.com/r/dataengineering/comments/1kke6ae/anyone_using_mariadb_118s_vector_features_with/,False,False,False,False
1kk7y09,Need advice on freelancing,1,4,deadprisoner,2025-05-11 18:37:13,https://www.reddit.com/r/dataengineering/comments/1kk7y09/need_advice_on_freelancing/,False,False,False,False
1kky7am,How LLMs Are Revolutionizing Database Queries Through Natural Language,0,0,Professional_Log599,2025-05-12 17:18:35,https://www.queryhub.ai/blog/natural-language-to-sql-llm,False,False,False,False
1kkfcnq,Compatible with legacy hist data,0,0,raulfanc,2025-05-12 00:18:30,https://www.reddit.com/r/dataengineering/comments/1kkfcnq/compatible_with_legacy_hist_data/,False,False,False,False
1kkd65p,Refreshing Excel from files in SharePoint... Any way to avoid cache issues?,0,2,DexterTwerp,2025-05-11 22:28:15,https://www.reddit.com/r/dataengineering/comments/1kkd65p/refreshing_excel_from_files_in_sharepoint_any_way/,False,False,False,False
1kkx037,3NF before Kimball dimensional modeling,0,3,data_def_ash,2025-05-12 16:31:28,https://www.reddit.com/r/dataengineering/comments/1kkx037/3nf_before_kimball_dimensional_modeling/,False,False,False,False
1kkaode,Need help building this Project,0,2,___Nik_,2025-05-11 20:35:16,https://www.reddit.com/r/dataengineering/comments/1kkaode/need_help_building_this_project/,False,False,False,False
1kka3r2,Convert any data format to any data format,0,3,Popular-Stay-2637,2025-05-11 20:10:14,https://www.reddit.com/r/dataengineering/comments/1kka3r2/convert_any_data_format_to_any_data_format/,False,False,False,False
